{
  "$schema": "./schema.json",
  "id": "profile",
  "name": "profile",
  "description": "Imported from DXF",
  "units": "in",
  "dimensions": {
    "width": 3.399010206240731,
    "height": 1.2500000000000062
  },
  "start": {
    "x": -0.0009897937592682,
    "y": 9.3e-15
  },
  "contour": [
    {
      "type": "line",
      "to": {
        "x": -0.0009897937592682,
        "y": 0.8750000000000092
      }
    },
    {
      "type": "line",
      "to": {
        "x": -0.2509897937592824,
        "y": 0.8750000000000092
      }
    },
    {
      "type": "line",
      "to": {
        "x": -0.2509897937592824,
        "y": 1
      }
    },
    {
      "type": "line",
      "to": {
        "x": -0.3759897937592682,
        "y": 1
      }
    },
    {
      "type": "arc",
      "to": {
        "x": -0.6259897937592825,
        "y": 1
      },
      "radius": 0.125,
      "clockwise": false,
      "largeArc": false,
      "metadata": {
        "center": {
          "x": -0.5009897937592825,
          "y": 1
        }
      }
    },
    {
      "type": "line",
      "to": {
        "x": -0.7509897937592683,
        "y": 1
      }
    },
    {
      "type": "line",
      "to": {
        "x": -0.7509897937592683,
        "y": 0.8750000000000003
      }
    },
    {
      "type": "arc",
      "to": {
        "x": -2.0250000000000012,
        "y": 1.2500000000000067
      },
      "radius": 1.903032823744636,
      "clockwise": true,
      "largeArc": false,
      "metadata": {
        "center": {
          "x": -0.8844128238712315,
          "y": 2.773349868513501
        }
      }
    },
    {
      "type": "line",
      "to": {
        "x": -2.149999999999999,
        "y": 1.25
      }
    },
    {
      "type": "arc",
      "to": {
        "x": -3.149999999999999,
        "y": 1.25
      },
      "radius": 0.5,
      "clockwise": false,
      "largeArc": true,
      "metadata": {
        "center": {
          "x": -2.649999999999999,
          "y": 1.25
        }
      }
    },
    {
      "type": "line",
      "to": {
        "x": -3.274999999999999,
        "y": 1.25
      }
    },
    {
      "type": "line",
      "to": {
        "x": -3.274999999999999,
        "y": 0.7500000000000006
      }
    },
    {
      "type": "line",
      "to": {
        "x": -3.399999999999999,
        "y": 0.7500000000000006
      }
    },
    {
      "type": "line",
      "to": {
        "x": -3.399999999999999,
        "y": 4e-16
      }
    },
    {
      "type": "line",
      "to": {
        "x": -0.0009897937592682,
        "y": 9.3e-15
      }
    }
  ]
}